{
  "$schema": "../schema.json",
  "name": "Makera Z1",
  "company": "Makera",
  "price": 1099.0,
  "currency": "EUR",
  "image_url": "https://cdn.shopify.com/s/files/1/0969/4078/5963/files/10_ed9b2a27-1976-47be-a10e-67ba37f2b5ac.jpg?v=1778571347&width=1200",
  "last_updated": "27.09.2026",
  "stage": "preorder",
  "notes": "EU store pre-order price for the Z1 Standalone (regular €1,199; Makera announces an MSRP increase of €200 from 1 Oct 2026); current batch ships from the factory in 5-10 business days. Z1 Pro adds ball screws and closed-loop steppers. Weight 17 kg per spec table (quick-start guide: ~20 kg net). Accuracy = stated resolution 0.02 mm (FAQ: tolerance range 0.02 mm, i.e. ±0.01 mm); repeatability 0.002 mm per vendor FAQ. Custom quick-change collet (1/8\" standard; 1/4\", 6, 4, 3 mm optional). Wired Z probe included; the included 3D probe rod works on conductive stock only. Optional 4th axis (Ø80 × 150 mm) and 5 W laser.",
  "general": {
    "machine_type": "mill",
    "axis": 3,
    "working_x": 200.0,
    "working_y": 200.0,
    "working_z": 100.0,
    "enclosed": true,
    "footprint_x": 350.0,
    "footprint_y": 470.0,
    "footprint_z": 450.0,
    "weight": 17.0,
    "accuracy": 0.02,
    "control_system": "smoothieware",
    "assembled": true,
    "only_base": false
  },
  "motion": {
    "motor_kind": "nema17",
    "drive_system": "leadscrew",
    "linear_guides": "linear_rails",
    "feed": 1200,
    "repeatability": 0.002
  },
  "spindle": {
    "power": 150,
    "cooling": "air",
    "system": "proprietary",
    "tools": 1,
    "max_rpm": 13000,
    "min_rpm": 0,
    "diameter": null,
    "runout": 0.01
  },
  "coolant": {
    "mql": false,
    "flood": false
  },
  "probe": {
    "tool_length": true,
    "z_probe": true,
    "probe_3d": false
  },
  "media": {
    "website": "https://eu.makera.com/de/products/makera-z1-desktop-cnc",
    "youtube": [
      "https://www.youtube.com/watch?v=Z6iT_2oHvhA",
      "https://www.youtube.com/watch?v=Yezf4sTRg7Y",
      "https://www.youtube.com/watch?v=PyaUHFfjZ88"
    ],
    "discord": "https://discord.com/invite/NQ5r9jGNXV"
  },
  "accessories": [
    {
      "name": "Makera Z1 4th Axis Module",
      "price": 269.0,
      "image_url": "https://cdn.shopify.com/s/files/1/0969/4078/5963/files/42fa5eddc491c5faa0e75b468d5a8eee_d2940d06-1b80-48f8-bf16-97cd342829a8.jpg?v=1780641283&width=1200",
      "description": "Belt-driven rotary module for the Z1 (Ø80 × 150 mm) for cylindrical and multi-sided parts.",
      "url": "https://eu.makera.com/de/products/makera-z1-4th-axis-module"
    },
    {
      "name": "Makera Z1 Laser Module",
      "price": 139.0,
      "image_url": "https://cdn.shopify.com/s/files/1/0969/4078/5963/files/0353f7a58e13e30b33b0484170832355_58d529c8-4600-47f5-a9b6-fd3de1d31a1d.jpg?v=1780641283&width=1200",
      "description": "5 W 445 nm diode laser head that installs like a milling bit, for engraving.",
      "url": "https://eu.makera.com/de/products/makera-z1-laser-module"
    },
    {
      "name": "Makera 3D Wired Probe",
      "price": 89.0,
      "image_url": "https://cdn.shopify.com/s/files/1/0969/4078/5963/files/5f0851991d11c4f27f4aa50d084cf703.jpg?v=1780641282&width=1200",
      "description": "3D touch probe for edge, centre and surface finding on metal and non-metal workpieces.",
      "url": "https://eu.makera.com/de/products/makera-3d-wired-probe"
    },
    {
      "name": "Makera Cyclone Dust Collector Lite",
      "price": 359.0,
      "image_url": "https://cdn.shopify.com/s/files/1/0969/4078/5963/files/d607457645dfc036ec01c5305f40d7fd.jpg?v=1780641283&width=1200",
      "description": "Compact cyclone dust collector with automated machine control; the recommended extractor for the Z1.",
      "url": "https://eu.makera.com/de/products/dust-collector-lite"
    },
    {
      "name": "Makera Cyclone Dust Collector",
      "price": 619.0,
      "image_url": "https://cdn.shopify.com/s/files/1/0969/4078/5963/files/20260509-155737_750839d3-c4fc-4727-98c6-fd6422382eb3.png?v=1778324481&width=1200",
      "description": "Full-size cyclone dust collector with automated control for long, continuous milling jobs.",
      "url": "https://eu.makera.com/de/products/makera-cyclone-dust-collector"
    },
    {
      "name": "Makera Z1 Vacuum Bed",
      "price": 109.0,
      "image_url": "https://cdn.shopify.com/s/files/1/0969/4078/5963/files/e765cdb9399bed2cbdf0fd709581441a.jpg?v=1780641282&width=1200",
      "description": "Vacuum workholding bed for flat stock; requires a Makera Cyclone Dust Collector (Standard or Lite).",
      "url": "https://eu.makera.com/de/products/makera-z1-vacuum-bed"
    },
    {
      "name": "Makera Z1 Low-Profile Vise",
      "price": 89.0,
      "image_url": "https://cdn.shopify.com/s/files/1/0969/4078/5963/files/400e3bf32ba8f4b2c58def18e720b7d0.jpg?v=1780641282&width=1200",
      "description": "Low-profile side-clamping vise that keeps the top surface free and raises stock for through-cuts.",
      "url": "https://eu.makera.com/de/products/makera-z1-low-profile-vise"
    }
  ]
}
